{
  "format": "bikelog.product.v1",
  "component_type": "POWER_METER",
  "maker": "Example maker",
  "model": "Example power meter 1",
  "list_price": 49.9,
  "currency": "EUR",
  "specs": {
    "placement": "spider",
    "sides": "dual",
    "accuracy_pct": 1.5,
    "battery": "rechargeable, USB-C",
    "battery_life_h": 300,
    "protocols": "ANT+, Bluetooth",
    "crank_length_mm": 172.5,
    "spindle": "Shimano Hollowtech II",
    "weight_g": 250
  },
  "source": {
    "url": "https://example.com/product-page",
    "retrieved_at": "2026-10-25",
    "tool": "my-scraper 1.0"
  },
  "verified": false,
  "notes": "Optional free text",
  "items": [
    {
      "label": "Spare power meter 1",
      "price": 44.9,
      "purchase_date": "2026-10-20",
      "prior_usage": "NEW",
      "storage_location": "Workshop drawer"
    }
  ]
}
